{
  "required" : true ,
  "$schema" : "http://json-schema.org/draft-03/schema" ,
  "type" : "object" ,
  "properties" : {
    "id" : {
      "type" : "string" ,
      "required" : false
    } ,
    "threadId" : {
      "type" : "string" ,
      "required" : false
    } ,
    "labelIds" : {
      "type" : "array" ,
      "required" : false ,
      "items" : [
        {
          "type" : "string"
        }
      ]
    } ,
    "snippet" : {
      "type" : "string" ,
      "required" : false
    } ,
    "historyId" : {
      "type" : "string" ,
      "required" : false
    } ,
    "payload" : {
      "type" : "object" ,
      "required" : false ,
      "properties" : {
        "mimeType" : {
          "type" : "string" ,
          "required" : false
        } ,
        "filename" : {
          "type" : "string" ,
          "required" : false
        } ,
        "headers" : {
          "type" : "array" ,
          "required" : false ,
          "items" : [
            {
              "type" : "object" ,
              "properties" : {
                "name" : {
                  "type" : "string" ,
                  "required" : false
                } ,
                "value" : {
                  "type" : "string" ,
                  "required" : false
                }
              }
            }
          ]
        } ,
        "body" : {
          "type" : "object" ,
          "required" : false ,
          "properties" : {
            "size" : {
              "type" : "number" ,
              "required" : false
            }
          }
        } ,
        "parts" : {
          "type" : "array" ,
          "required" : false ,
          "items" : [
            {
              "type" : "object" ,
              "properties" : {
                "mimeType" : {
                  "type" : "string" ,
                  "required" : false
                } ,
                "filename" : {
                  "type" : "string" ,
                  "required" : false
                } ,
                "headers" : {
                  "type" : "array" ,
                  "required" : false ,
                  "items" : [
                    {
                      "type" : "object" ,
                      "properties" : {
                        "name" : {
                          "type" : "string" ,
                          "required" : false
                        } ,
                        "value" : {
                          "type" : "string" ,
                          "required" : false
                        }
                      }
                    }
                  ]
                } ,
                "body" : {
                  "type" : "object" ,
                  "required" : false ,
                  "properties" : {
                    "size" : {
                      "type" : "number" ,
                      "required" : false
                    }
                  }
                } ,
                "parts" : {
                  "type" : "array" ,
                  "required" : false ,
                  "items" : [
                  ]
                }
              }
            } , {
              "type" : "object" ,
              "properties" : {
                "partId" : {
                  "type" : "string" ,
                  "required" : false
                } ,
                "mimeType" : {
                  "type" : "string" ,
                  "required" : false
                } ,
                "filename" : {
                  "type" : "string" ,
                  "required" : false
                } ,
                "headers" : {
                  "type" : "array" ,
                  "required" : false ,
                  "items" : [
                    {
                      "type" : "object" ,
                      "properties" : {
                        "name" : {
                          "type" : "string" ,
                          "required" : false
                        } ,
                        "value" : {
                          "type" : "string" ,
                          "required" : false
                        }
                      }
                    }
                  ]
                } ,
                "body" : {
                  "type" : "object" ,
                  "required" : false ,
                  "properties" : {
                    "attachmentId" : {
                      "type" : "string" ,
                      "required" : false
                    } ,
                    "size" : {
                      "type" : "number" ,
                      "required" : false
                    }
                  }
                }
              }
            }
          ]
        }
      }
    } ,
    "sizeEstimate" : {
      "type" : "number" ,
      "required" : false
    }
  }
}